{
    "_id": "QfO:QfO4:G_STD_Vertebrata_OMA-GETHOGs_output",
    "_schema": "https://www.elixir-europe.org/excelerate/WP2/json-schemas/0.3/Dataset",
    "dataset_contact_id": [
        "unknown"
    ],
    "dates": {
        "creation": "2015-01-01T00:00:01Z",
        "modification": "2015-01-01T00:00:01Z"
    },
    "description": "Output dataset for the OMA-GETHOGs tool in the 'Generalized Species Tree Discordance' benchmark event with the correspondent metrics generated from it",
    "metrics": [
        {
            "metrics_id": "QfO:STD-recall1",
            "result": {
                "value": 11549
            }
        },
        {
            "metrics_id": "QfO:STD-precision",
            "result": {
                "value": 0.2057
            }
        },
        {
            "metrics_id": "QfO:precision_error",
            "result": {
                "value": 0.0071
            }
        }
    ],
    "name": "OMA-GETHOGs.tar.gz",
    "type": "Output",
    "version": "Vertebrata"
}