{
    "_id": "QfO:QfO4_TreeFam-A_OMA-GETHOGs_output",
    "_schema": "https://www.elixir-europe.org/excelerate/WP2/json-schemas/0.3/Dataset",
    "dataset_contact_id": [
        "unknown"
    ],
    "dates": {
        "creation": "2015-01-01T00:00:01Z",
        "modification": "2015-01-01T00:00:01Z"
    },
    "description": "Output dataset for the OMA-GETHOGs tool in the 'Agreement with Reference Gene Phylogenies: TreeFam-A' benchmark event with the correspondent metrics generated from it",
    "metrics": [
        {
            "metrics_id": "QfO:referenceTreeFam-A_recall",
            "result": {
                "value": 0.5959
            }
        },
        {
            "metrics_id": "QfO:referenceTreeFam-A_precision",
            "result": {
                "value": 0.89
            }
        },
        {
            "metrics_id": "QfO:recall_error",
            "result": {
                "value": 0.00500656
            }
        },
        {
            "metrics_id": "QfO:precision_error",
            "result": {
                "value": 0.00390173
            }
        }
    ],
    "name": "OMA-GETHOGs.tar.gz",
    "type": "Output",
    "version": "unknown"
}