{
    "_id": "QfO:QfO4_SwissTree_OMA-GETHOGs_output",
    "_schema": "https://www.elixir-europe.org/excelerate/WP2/json-schemas/0.3/Dataset",
    "dataset_contact_id": [
        "unknown"
    ],
    "dates": {
        "creation": "2015-01-01T00:00:01Z",
        "modification": "2015-01-01T00:00:01Z"
    },
    "description": "Output dataset for the OMA-GETHOGs tool in the 'Agreement with Reference Gene Phylogenies: SwissTree' benchmark event with the correspondent metrics generated from it",
    "metrics": [
        {
            "metrics_id": "QfO:referenceSwissTree_recall",
            "result": {
                "value": 0.8187
            }
        },
        {
            "metrics_id": "QfO:referenceSwissTree_precision",
            "result": {
                "value": 0.9956
            }
        },
        {
            "metrics_id": "QfO:recall_error",
            "result": {
                "value": 0.0452514
            }
        },
        {
            "metrics_id": "QfO:precision_error",
            "result": {
                "value": 0.00854029
            }
        }
    ],
    "name": "OMA-GETHOGs.tar.gz",
    "type": "Output",
    "version": "unknown"
}