{
    "_id": "QfO:QfO4_G_STD_LUCA_EnsemblCompara_output",
    "_schema": "https://www.elixir-europe.org/excelerate/WP2/json-schemas/0.3/Dataset",
    "dataset_contact_id": [
        "unknown"
    ],
    "dates": {
        "creation": "2015-01-01T00:00:01Z",
        "modification": "2015-01-01T00:00:01Z"
    },
    "description": "Output dataset for the EnsemblCompara tool in the 'Generalized Species Tree Discordance' benchmark event with the correspondent metrics generated from it",
    "metrics": [
        {
            "metrics_id": "QfO:STD-recall1",
            "result": {
                "value": 3806
            }
        },
        {
            "metrics_id": "QfO:STD-precision",
            "result": {
                "value": 0.241
            }
        },
        {
            "metrics_id": "QfO:precision_error",
            "result": {
                "value": 0.015
            }
        }
    ],
    "name": "EnsemblCompara.tar.gz",
    "type": "Output",
    "version": "LUCA"
}