{
	"_id": "QfO:QfO4_input_FASTA",
	"_schema": "https://www.elixir-europe.org/excelerate/WP2/json-schemas/0.3/Dataset",
	"name": "2011_04_reference_proteomes_FASTA-EBI",
	"version": "version 5; 2011_04",
	"description": "Reference Proteome data sets in FASTA format: collection of data providing a representative protein for each gene in the genome of selected species that have been generated annually from the uniProt Knowledgebase (UniProtKB) for the past five years",
	"dates": {
		"creation": "2011-04-01T00:00:00Z",
		"modification": "2011-04-01T00:00:00Z"
	},
	"type": "Input",
	"datalink": "ftp://ftp.ebi.ac.uk/pub/databases/reference_proteomes/previous_releases/qfo_release-2011_04/",
	"dataset_contact_id": [
		"Toni.Gabaldon",
		"Erik.Sonnhammer",
		"Christophe.Dessimoz",
		"Paul.Thomas"
	],
	"references": [
		"https://www.ncbi.nlm.nih.gov/pubmed/22102590"
	]
}
