{
	"_id": "QfO:QfO4_output_RBH-BBH",
	"_schema": "https://www.elixir-europe.org/excelerate/WP2/json-schemas/0.3/Dataset",
	"name": "RBH__BBH-.621.rels",
	"version": "v1.0",
	"description": "Output data set (pairwise orthologs predictions) for RBH-BBH tool",
	"dates": {
		"creation": "2016-01-12T16:40:11Z",
		"modification": "2016-01-12T16:40:11Z"
	},
	"type": "Output",
	"datalink": "http://orthology.benchmarkservice.org/raw/RBH__BBH-.621.rels.raw.gz",
	"dataset_contact_id": [
		"unknown"
	]
}
