{
	"_id": "QfO:QfO4_output_RSD",
	"_schema": "https://www.elixir-europe.org/excelerate/WP2/json-schemas/0.3/Dataset",
	"name": "rsd_0.8_1e-5_deluca_test-.771.rels",
	"version": "v1.0",
	"description": "Output data set (pairwise orthologs predictions) for RSD 0.8 1e-5 Deluca tool",
	"dates": {
		"creation": "2012-02-08T20:28:20Z",
		"modification": "2012-02-08T20:28:20Z"
	},
	"type": "Output",
	"datalink": "http://orthology.benchmarkservice.org/raw/rsd_0.8_1e-5_deluca_test-.771.rels.raw.gz",
	"dataset_contact_id": [
		"ToddF.DeLuca",
		"DennisP.Wall"
	]
}
