{
    "_id": "QfO:QfO4:GOtest_OMA-GETHOGs_output",
    "_schema": "https://www.elixir-europe.org/excelerate/WP2/json-schemas/0.3/Dataset",
    "dataset_contact_id": [
        "unknown"
    ],
    "dates": {
        "creation": "2015-01-01T00:00:01Z",
        "modification": "2015-01-01T00:00:01Z"
    },
    "description": "Output dataset for the OMA-GETHOGs tool in the 'Gene Ontology Conservation Test' benchmark event with the correspondent metrics generated from it",
    "metrics": [
        {
            "metrics_id": "QfO:GOConservationTest-recall",
            "result": {
                "value": 123176
            }
        },
        {
            "metrics_id": "QfO:GOConservationTest-precision",
            "result": {
                "value": 0.4815
            }
        },
        {
            "metrics_id": "QfO:precision_error",
            "result": {
                "value": 0.0012
            }
        }
    ],
    "name": "OMA-GETHOGs.tar.gz",
    "type": "Output",
    "version": "unknown"
}