{
	"_id": "QfO:QfO4_output_PhylomeDB",
	"_schema": "https://www.elixir-europe.org/excelerate/WP2/json-schemas/0.3/Dataset",
	"name": "phylomeDB-.389.rels",
	"version": "v1.0",
	"description": "Output data set (pairwise orthologs predictions) for PhylomeDB tool",
	"dates": {
		"creation": "2013-06-06T11:51:18Z",
		"modification": "2013-06-06T11:51:18Z"
	},
	"type": "Output",
	"datalink": "http://orthology.benchmarkservice.org/raw/phylomeDB-.389.rels.raw.gz",
	"dataset_contact_id": [
		"Toni.Gabaldon"
	]
}
